[
  {
    "schema_version": 1,
    "request_id": "req-1",
    "base_revision": 1,
    "status": "completed",
    "text": "So the meeting is at three.",
    "failure": null,
    "provider": {
      "id": "local-s1",
      "kind": "s1",
      "locality": "local",
      "route": "local-authoring-default",
      "model": "s1-mini",
      "artifact_sha256": "0000000000000000000000000000000000000000000000000000000000000001"
    },
    "timing": {
      "queued_ms": 1.5,
      "processing_ms": 412.0,
      "stop_to_result_ms": 655.25
    }
  },
  {
    "schema_version": 1,
    "request_id": "req-1",
    "base_revision": 1,
    "status": "completed",
    "text": "",
    "failure": null,
    "provider": {
      "id": "local-s1",
      "kind": "s1",
      "locality": "local",
      "route": "local-authoring-default",
      "model": "s1-mini",
      "artifact_sha256": "0000000000000000000000000000000000000000000000000000000000000001"
    },
    "timing": {
      "queued_ms": 1.5,
      "processing_ms": 412.0,
      "stop_to_result_ms": 655.25
    }
  },
  {
    "schema_version": 1,
    "request_id": "req-2",
    "base_revision": 1,
    "status": "failed",
    "text": null,
    "failure": {
      "reason": "rate_limited",
      "retryable": true,
      "detail": "429 Too Many Requests"
    },
    "provider": {
      "id": "remote-openai",
      "kind": "openai_compatible",
      "locality": "remote",
      "route": "remote-authoring-openai",
      "model": "gpt-4.1-mini",
      "artifact_sha256": null
    },
    "timing": {
      "queued_ms": 0.0,
      "processing_ms": 88.0,
      "stop_to_result_ms": null
    }
  },
  {
    "schema_version": 1,
    "request_id": "req-2",
    "base_revision": 1,
    "status": "failed",
    "text": null,
    "failure": {
      "reason": "truncated_output",
      "retryable": false,
      "detail": "finish_reason=length"
    },
    "provider": {
      "id": "remote-openai",
      "kind": "openai_compatible",
      "locality": "remote",
      "route": "remote-authoring-openai",
      "model": "gpt-4.1-mini",
      "artifact_sha256": null
    },
    "timing": {
      "queued_ms": 1.5,
      "processing_ms": 412.0,
      "stop_to_result_ms": 655.25
    }
  },
  {
    "schema_version": 1,
    "request_id": "req-2",
    "base_revision": 1,
    "status": "cancelled",
    "text": null,
    "failure": {
      "reason": "cancelled",
      "retryable": false,
      "detail": ""
    },
    "provider": {
      "id": "remote-openai",
      "kind": "openai_compatible",
      "locality": "remote",
      "route": "remote-authoring-openai",
      "model": "gpt-4.1-mini",
      "artifact_sha256": null
    },
    "timing": {
      "queued_ms": 1.5,
      "processing_ms": 412.0,
      "stop_to_result_ms": 655.25
    }
  }
]
